#######################################;x }
##### ASSIMILATION TROUBLE EVENTS #####;x {
#######################################;x
EVTDESC2000;Foreign immigrants arriving in new countries often find themselves living together concentrated in relatively small areas, living in close proximity to, and seeking mutual support from, their national brethren, often forming little 'ethnic enclaves'. $PROVINCENAME$ is no exception, as the immigrant community there has formed a just such a thing, complete with all the cultural, linguistic and culinary flavors of the immigrants' homeland;;;;;;;;;;x
EVTDESC2001;It has been twenty days. Twenty days without work, without money, without any chance to feed or clothe my family. Twenty days... Twenty days is an eternity when you have to rummage through the garbage to find something to eat. I don't want to beg, I don't want to steal, but twenty days without work...'\n\nFew immigrants, who left their country to live and work in your country, are able to find work.;;x
EVTDESC2002;Romance is in the air in $PROVINCENAME$, where a marriage between one of the province's immigrant sons, and a young local girl, is being celebrated by friends and family. Some decry the development as the end of $COUNTRY_ADJ$ civilization, but the young couple sure do look happy. Immigration is changing $PROVINCENAME$ in ways both big and small.;;;;;;;;;;x
EVTDESC2003;Anja Yesi-whatnow?'\n'Aniya Yezierska. Is my name unpronounceable?'\n'Kind of. Would you like to change it? It could be difficult for you to get a job otherwise.'\n\nUnpronounceable names and strange spellings could cause trouble for job-seeking immigrants.;;x
EVTDESC2004;The many immigrants who have arrived in the country have created a demand for housing. The construction of new homes must be speeded up when reports show that many immigrants share housing with up to ten or twenty people. This is a minor disaster as this could create epidemics, revolts and other disturbances.;;x
EVTDESC2005;The immigrants in $PROVINCENAME$ have gone out in a demonstration, protesting the lack of equal citizenship, and demanding equal recognition under the law for all $COUNTRY_ADJ$ citizens.;;;;;;;;;;x
EVTDESC2006;Riots have broken out in $PROVINCENAME$'s immigrant communities. While formally citizens, many immigrants feel that the state does not accord them proper recognition, and that they do not have the same opportunities as proper nationals.;;;;;;;;;;x
EVTDESC2007;I pledge allegiance, to the realm of $COUNTRY$, and to the government for which it stands'\n\nNot one eye dry in the audience in $PROVINCENAME$ today, as some of our immigrants today took the pledge of allegiance, and confirmed their loyalty to the $COUNTRY_ADJ$ state.;;;;;;;;;;x
EVTDESC2008;Immigrants arriving in $COUNTRY$ often have small means both in terms of money and in terms of opportunity. Many of them have wound up in $PROVINCENAME$'s poor quarters, and those quarters are increasingly taking on the characteristics of a ghetto. It could be a good idea to do something about these squalid living conditions, lest they worsen.;;;;;;;;;;x
EVTDESC2009;Newly arrived immigrants in $PROVINCENAME$ are finding it hard to assimilate into the broader $COUNTRY_ADJ$ populace, and many among the local population have come to view them as an alien presence. Immigrants live in separate areas of the city, go to separate schools and shops, and generally have very little contact with the extended community.;;;;;;;;;;x
EVTDESC2010;Following an extended period of civil unrest in $PROVINCENAME$, local anti-immigrant sentiments have exploded into a full scale riot. Shop windows have been smashed, and several of the recently arrived have been murdered, as immigrants are blamed for all manner of social ills, real or perceived;;;;;;;;;;x
EVTDESC2011;The newly arrived immigrants in $PROVINCENAME$ have brought with them the collected experiences of their home country, and their songs now blend with ours in the ever-changing symphony that is $COUNTRY$. Their customs have enriched our own, and created interesting new blends of cultural expression in the fields of art, science and architecture.;;;;;;;;;;x
#####################;x }
##### CB EVENTS #####;x {
#####################;x
EVTDESC2500;Our ambassador to one of the other great powers has telegraphed home expressing his frustration with the response, or rather, lack of it, that he has received while trying to settle a bilateral extradition treaty with the country in question. Apparently our ambassador has been snubbed repeatedly by this foreign administration, and has been delegated to speaking to civil servants instead of being allowed direct access to the country's decision makers. This diplomatic back-and-forth has been going on for two months.;;;;;;;;;;x
EVTDESC2501;On this subject I would like to bring up the issue of a merchant, operating out of one of my constituencies, who wrote to me last month with a most distressing story of how trade goods of his had been seized by customs officials in a foreign port. Again, I can only reiterate that further tolerance of these abridgments of the unrestricted freedom of international trade will only serve to compound the problem further with every year that passes.'\n\nAn MP known for his ardent support of free trade has held a speech in parliament today, detailing grievances against a foreign power.;;;;;;;;;;x
EVTDESC2502;The $PROVINCENAME$ area has been under $COUNTRY_ADJ$ control for some time, and, now, after many years, it does seem that the citizens of this province themselves consider $COUNTRY_ADJ$ rule to be the only legitimate rule there is. This province is now a part of $COUNTRY$'s patrimony.;;;;;;;;;;x
EVTDESC2504;News reaches us from $FROMCOUNTRY$ that the local ruling elites have thrown our ambassador out of the realm, and that their troops are laying siege to our embassy with apparent intent to enforce that decision. This affair is developing into an enormous loss of international face, one which can only be avoided through a formal declaration of war against $FROMCOUNTRY$. Sire, how should we respond?;x
EVTDESC2506;According to our peace treaty with $FROMCOUNTRY$, we must give up lands that rightfully belong to them -- and only the ones that belong to them.;;;;;;;;;;;;;
EVTDESC2507;According to our peace treaty with $FROMCOUNTRY$, we must give up lands that rightfully belong to another nation -- but only those lands.;;;;;;;;;;;;;
EVTDESC2508;As a result of the treaty with $FROMCOUNTRY$, some of $COUNTRY$'s lands are to be returned. We are, however, only entitled to those lands over which we have a claim. Any others should, by all rights, be returned to $FROMCOUNTRY$. \n \n §RNOTE: If you took $FROMCOUNTRY_ADJ$ core provinces which are not also your own core provinces in this war, enacting the 'return' option will give those lands back. Be careful!§W;;;;;;;;;;;;;
EVTDESC2509;The past war has potentially shifted our alignment.;x
EVTDESC2510;We have been freed under the pretenses that we become a vassal of our liberators. Now comes the time that we submit.;x
##########################;x }
##### REVOLTS EVENTS #####;x {
##########################;x
EVTDESC3000;To our leadership's dismay, the army was overwhelmed by the Democratic Rebels that plagued $CAPITAL$. They have been able to force their demands, increasing voter rights.;x
EVTDESC3001;To our leadership's dismay, the army was overwhelmed by the Fundamentalist Rebels that plagued $CAPITAL$. They have been able to force their demands, in an attempt to return the $COUNTRY$ to its glory days.;x
EVTDESC3002;To our leadership's dismay, the army was overwhelmed by the Noble Rebels that plagued $CAPITAL$. They have been able to for their demands, increasing the nobility's privileges.;x
EVTDESC3003;To our leadership's dismay, the army was overwhelmed by the Good Rebels that plagued $CAPITAL$. They have been able to for their demands, removing all influences of Neutrality and Evil from the government.;x
EVTDESC3004;To our leadership's dismay, the army was overwhelmed by the Evil Rebels that plagued $CAPITAL$. They have been able to for their demands, removing all influences of Good and Neutrality from the government.;x
EVTDESC3005;To our leadership's dismay, the army was overwhelmed by the Neutral Rebels that plagued $CAPITAL$. They have been able to for their demands, removing all influences of Good and Evil from the government.;x
EVTDESC3006;$COUNTRY_ADJ$ patriots have risen up in a neighboring country, and have gained sufficient control that they have sent word they wish to bring the province back to $COUNTRY$. Agreeing would mean risking war, but refusing would mean angering our people.;x
EVTDESC3008;With the patriot rebellion now over, our provinces have now been brought under control and $COUNTRY_ADJ$ nobility are once again in command.;;;;;;;;;;;;;
#################################;x }
##### Dynamic Traits Events #####;x {
#################################;x
EVTDESC3500;We have a new leader! With this, comes a potential for different traits...;x
EVTDESC3501;It is a sad day for the $COUNTRY$. Our leader has died!;x
EVTDESC3502;Our ruler's decisions has given/taken away a trait!;x
EVTDESC3503;In some places, the common folk are asking for some money to help them get by. Should we give it to them?;x
EVTDESC3504;Our ruler's decisions has given/taken away a trait!;x
EVTDESC3505;A non-ally is asking for monetary aid. Should we give it to them?;x
EVTDESC3506;Our ruler's decisions has given/taken away a trait!;x
EVTDESC3507;The local aristocrats and guild masters have been asking to have an audience with our ruler via a game of golf. Should our ruler play?;x
EVTDESC3508;Our ruler's decisions has given/taken away a trait!;x
EVTDESC3509;We have the potential to give some our of people some gifts. Should we take the opportunity to do so?;x
EVTDESC3510;Our ruler's decisions has given/taken away a trait!;x
EVTDESC3511;In a trial, one of the sides is offering money to help decide the case. Should we take this bribe?;x
#################################;x }
##### POP MANAGEMENT EVENTS #####;x {
#################################;x
EVTDESC9500;This event allows you to choose to manage pop militancy or their breakdown;x
EVTDESC9501;This event gives you a myriad of choices regarding pop militancy;x
EVTDESC9502;This event allows you to convert non-accepteds or non-primaries into labourers to better facilitate cultural conversion. Please note that this may destroy your economy or research point gain.;x
EVTDESC9503;This event allows you to set your slaving rules. §RKeep in mind that these rules are global (for your realm), so if in the past you were not enslaving any pops, but change the rules, any pop that fills the requirements will be enslaved, regardless of when the land they reside in was conqeuered§!.;x
EVTDESC9504;We have some pops that should by slaves by the slave rules we have...;x
EVTDESC9505;We have some pops that should be slaves by the slave rules we have...;x
############################;x }
##### WORKPLACE EVENTS #####;x {
############################;x
EVTDESC12000;The black smoke pouring out from the pit, in long, drawn out billows, with the intensity of the smell almost drowns out an undertone of burnt flesh. A hurried commotion breaks out as the survivors of the mine collapse in $PROVINCENAME$ scurry to save what is left of the mine. The seams in the coalfield lie, sleeping for centuries, embedded in pockets of methane. A carelessly lit lantern or a spark from a pick striking rock, and a sea of hellfire.;x
EVTDESC12001;One of our production centers has experienced a severe shortfall in production over the past couple months, which has gone unreported for fear of causing alarm among the common folk. By covering the underproduction by buying the goods from other nations, we could stop the people from discovering this shortage.;x
EVTDESC12025;While the war rages, every piece of food from '$PROVINCENAME$ is as good as any sword or bow. In fact, this province is producing more food than normal. What should we do with it?;x
EVTDESC12026;A strange fever has erupted among the cattle in $PROVINCENAME$, and the cattle are reported dying en masse. Local healers in the province are attempting what little can be done to stave off the effects of this, apparently quite contagious, disease. While the disease itself will eventually dissipate, the question of reimbursement for hundreds of ruined farmers and their families still requires attention.;x
EVTDESC12027;The goods produced in $PROVINCENAME$ is of the highest possible quality. In fact, the quality is so high that the goods produced in $PROVINCENAME$ have begun building quite a reputation for themselves as being some of the best available in Middle Earth. The reputation has built for quite some time, and the locals have begun taking pride in the fact that, in their good's world, $PROVINCENAME$ is a byword for quality.;x
EVTDESC12051;A new, rich lode of ore has been discovered in the $PROVINCENAME$ mine.;x
EVTDESC12052;The goods being produced out of $PROVINCENAME$ are highly exceeding expectations in terms of quantity.;x
EVTDESC12998;Our capital does not produce to the goods it should be producing.;x
EVTDESC12999;A province that is not our capital is producing goods that only our capital should be producing.;x
###########################;x }
##### ELECTION EVENTS #####;x {
###########################;x
EVTNAME14000;$COUNTRY_ADJ$ Guild Autonomy Policy;;;;;;;;;;x
EVTNAME14000_sub;A Heated Debate in $COUNTRY$;;;;;;;;;;x
EVTDESC14000;The question of Guild Autonomy has come around this election cycle. There are stauch supporters across the spectrum, with major proponents for guilds being independent, the Realm having some oversight into the guilds, and the Realm completely controlling the guilds. What is the current leadership's stance?;;;;;;;;;x
EVTNAME14001;$COUNTRY_ADJ$ Racial Policy;;;;;;;;;;x
EVTNAME14001_sub;A Heated Debate in $COUNTRY$;;;;;;;;;x
EVTDESC14001;The question of Racial policy have come around this election cycle. There are stauch supporters across the spectrum, with major proponents for allowing all races, non-Orcs and only our race. What is the current leadership's stance?;;;;;;;;;x
EVTNAME14002;$COUNTRY_ADJ$ Language Policy;;;;;;;;;;x
EVTNAME14002_sub;A Heated Debate in $COUNTRY$;;;;;;;;;x
EVTDESC14002;The question of Language policy have come around this election cycle. There are stauch supporters across the spectrum, with major proponents for allowing all languages, giving some toleration of accepted minority languages and only our language. What is the current leadership's stance?;;;;;;;;;x
EVTNAME14003;$COUNTRY_ADJ$ Diplomatic Policy;;;;;;;;;;x
EVTNAME14003_sub;A Heated Debate in $COUNTRY$;;;;;;;;;x
EVTDESC14003;The question of Diplomatic policy have come around this election cycle. There are stauch supporters across the spectrum, with major proponents for an isolationist policy, a reactive policy, a proactive policy and an interactive policy. What is the current leadership's stance?;;;;;;;;;x
EVTNAME14004;$COUNTRY_ADJ$ War Policy;;;;;;;;;;x
EVTNAME14004_sub;A Heated Debate in $COUNTRY$;;;;;;;;;x
EVTDESC14004;The question of War policy have come around this election cycle. There are stauch supporters across the spectrum, with major proponents for a jingoist policy, a pro-military policy, an anti-militaary policy and a pacifist policy. What is the current leadership's stance?;;;;;;;;;x
########################################;x }
##### NATIONALIST MOVEMENTS EVENTS #####;x {
########################################;x
EVTDESC15000;Dissent has been growing among the $PROVINCECULTURE$ population in $PROVINCENAME$ for some time, and tensions now threaten to reach the boiling point after the local garrison tried to disperse a crowd in violation of the ban on public meetings. The situation escalated with violence on both sides, and a young boy was killed when police resorted to violence.;;x
EVTDESC15001;As a part of our realm's racial policy, soldiers of the army have been ordered only to buy goods from $COUNTRYCULTURE$ traders. This is starting to aggravate already existing tensions in $PROVINCENAME$, as local $PROVINCECULTURE$ traders feel the effects of the discrimination.;;x
EVTDESC15002;Avast! Awake ye, sons of slumber! The morning calls you forth!'\n\nA $PROVINCECULTURE$ poet, disturbed by the lack of a $PROVINCECULTURE$ national consciousness, has published a the lore of his people that is quickly developing into a symbol of resistance against our rule in $PROVINCENAME$. We could get rid of the poet, but doing so does entail the risk of being discovered. How should we act?;x
EVTDESC15003;A trade union for $PROVINCECULTURE$ artisans has formed illegally in $PROVINCENAME$, and local authorities have brought the matter to our attention. Shutting down the operations of the Union is necessary to avoid a complete halt to output in the province, but doing so might cause aggravations, how should we proceed?;;x
EVTDESC15004;The writing on the wall has been plain to see for some time, but officials in $PROVINCENAME$ now have definite confirmation that the locals are plotting an insurgency against $COUNTRY_ADJ$ rule. The Army has managed to secure detailed plans for the insurgency through informants and double-agents, and needs to know how to act. Our options are to fight the insurgents in one concentrated battle, or to try to divide them up and dissipate their forces out into the surrounding countryside.;;x
EVTDESC15005; A young $PROVINCECULTURE$ boy in $PROVINCENAME$ has had to learn the hard way that one does not insult officers of the $COUNTRY_ADJ$ army without it having its consequences. As he comes to his senses again, he puts his fingers to his nose and draws them back red with blood. The standing army in $PROVINCENAME$ is causing strain on our relations with the locals. We could enforce a stricter code of conduct, but that would cause uproar in the capital.;;x
EVTDESC15006;So take arms! Impoverished, starved and hungry brethren of $PROVINCENAME$. In name of our Lord and in defense of eternal rights, let us drive the occupiers out of our native land!' Local aristocrats in $PROVINCENAME$ are arguing revolution against our rule. We could confront them now, but then again it might be better to wait for another opportunity.;;x
EVTDESC15007;A loremaster of some renown has published a book on $PROVINCECULTURE$ history in $PROVINCENAME$. This book has the potential to become fairly explosive stuff among the $PROVINCECULTURE$ minority, but we are in a position to exert some influence over it's distribution. If we curtail the distribution, only the higher classes will have access to the book. If, on the other hand, do not curtail the distribution, then the book will probably instead see it's biggest readership among the middle classes. How should we proceed?;;x
EVTDESC15008;The situation in the $PROVINCECULTURE$ provinces has reached the boiling point, and leading members of the $PROVINCECULTURE$ communities have assembled newly appointed leadership in $PROVINCENAME$. Citing the proud traditions of $PROVINCECULTURE$ autonomy and self-rule, the rights of peoples, and the repeated injuries suffered under what they refer to as the '$COUNTRY_ADJ$ yoke', they demand independence.;;x
EVTDESC15009;Routine maintenance of the road system in $PROVINCENAME$ threatens to spark conflict, as road sign language has become an issue. While our local authorities feel that using our own language would be best, some voices have been raised saying that we might offend local sensibilities by not using the local tongue. Using local placenames will hinder the province from integrating economically with the rest of our country, while using our own language will doubtlessly upset the locals. Regardless of which, the locals will feel that all roads in $COUNTRY$ lead to $CAPITAL$.;;x
EVTDESC15010;A committee of $PROVINCECULTURE$ businessmen and traders from $PROVINCENAME$ have approached the government in $CAPITAL$, wishing to lodge a formal complaint with the open discrimination they face in competition for government contracts. Our government currently pursues a favorization policy - preferring $COUNTRY_ADJ$ contractors wherever possible - and this is causing discontent in the $PROVINCECULTURE$ provinces. The committee represents equally the interests of the artisan and capitalist classes of the province, and we could try to sow discontent among them.;;x
EVTDESC15011;A secret $COUNTRY_ADJ$ weapons cache in $PROVINCENAME$ was found broken up and looted early this morning. Among the loot was at least one major artillery piece. $PROVINCECULTURE$ partisans have claimed responsibility, and local officials are now fearful of having to deal with a heavily armed resistance in the event of a $PROVINCECULTURE$ uprising in $PROVINCENAME$. Concerns have also been raised that this will embolden the already radicalized $PROVINCECULTURE$ independence movement.;;x
EVTDESC15012;Some of our guilds in $PROVINCENAME$ have been damaged, and officials suspect that $PROVINCECULTURE$ saboteurs are behind the attack. We have no conclusive proof at the moment, but a thorough investigation might give us new insights, though it will cost us.;;x
EVTDESC15013;A planned uprising of the marginalized $PROVINCECULTURE$ nobility against $COUNTRY_ADJ$ rule has quickly devolved into something else entirely. The peasants in $PROVINCENAME$, responding to appeals of loyalty to the cause of $COUNTRYNAME$, and resistance against the rebellious nobles, have risen up against the nobles! The peasant mobs have quickly gained the upper hand in the conflict, and we now have the option of intervening to suppress them, or letting them have their way with the aristocrats. Doing the former would leave us with fewer rebellious nobles, but it might be frowned upon by the rest of Middle Earth.;;x
EVTDESC15014;The signs have been evident for some time. Whispers can be heard on the barracks' grounds, and sometimes, when a $COUNTRY_ADJ$ officer enters a room, even the liveliest of conversations seem to die down, as if it had bumped into some immutable hinder. The $PROVINCECULTURE$ Officers Corps in $PROVINCENAME$ is becoming increasingly attracted to the cause of $PROVINCECULTURE$ nationalism and separatism, and we can prove it. We have the options of ignoring these things for the time being, or getting rid of some of the more outspoken officers.;;x
EVTDESC15015;The hands on the clock point five minutes to twelve. His eyes peer across the town square, seemingly undaunted by the commotion, and the risk. He climbs to the podium, and begins to speak. For hours, he talks. Of the $PROVINCECULTURE$ nation, its oppression, its cause, and its future, in a language that reverberates with nothing save the clear tones of a just cause. The $COUNTRY_ADJ$ gendarmes storm the square, and soon he is gone. Somewhere, far away in the city, a bell strikes twelve. A young $PROVINCECULTURE$ nationalist is in our custody. What should we do with him?;;x
EVTDESC15016;Their movements are sluggish. Often times, they can be seen milling about the barracks with little regard for military decorum. When called to attention, their hands draw toward their foreheads with just the right amount of delay. Not slow enough to deserve punishment, not fast enough to be a believable display of loyalty. These soldiers are $PROVINCECULTURE$, not $COUNTRY_ADJ$.;;x
EVTDESC15017;An Arts & Letters club in another realm supports the cause of $PROVINCECULTURE$ independence, and is exchanging contacts with people in $PROVINCENAME$. We could take steps and measures to isolate $PROVINCENAME$ from harmful outside influences -- by, for example, having the Army browse through incoming mail -- but this would of course cause a drop in relations with the foreign power in question. We could also simply ignore the issue, and allow our dissatisfied $PROVINCECULTURE$ subjects to establish international contacts, but that might not be the best idea.;x
EVTDESC15018;A small $PROVINCECULTURE$ patriotic society has reached local prominence in $PROVINCENAME$. Ostensibly claiming to simply organize $PROVINCECULTURE$ citizens of $COUNTRY$ to benefit of the local community, we suspect that the organization is, in fact, covertly arguing, supporting, aiding and abetting the cause of $PROVINCECULTURE$ independence. We could shut it down, though that would cause a fair amount of militancy.;;x
EVTDESC15019;Up until now, $PROVINCECULTURE$ priests in $PROVINCENAME$ have been allowed to conduct non-$COUNTRY_ADJ$ traditions. This generosity on our part has apparently been excessive, since the privilege has been used to spread anti-$COUNTRY_ADJ$ propaganda among the $PROVINCERELIGION$ congregations in $PROVINCENAME$. We could issue an edict to the effect that all non-$COUNTRY_ADJ$ traditions are illegal, but that would surely anger the populace. Should we?;x
EVTDESC15020;In our efforts to assimilate our $PROVINCECULTURE$ provinces into the $COUNTRY_ADJ$ state, bright minds within our administration have come up with an idea to restrict the rights of the $PROVINCECULTURE$ minority, and others, to construct buildings and own land. While this measure will be extremely unpopular among our minorities, it will most likely hasten the assimilation process. Do we want to implement the building restrictions?;;x
EVTDESC15021;Old man Dryzymala has come up with a cunning plan to circumvent the $COUNTRY_ADJ$ ban on the erection of permanent houses for $PROVINCECULTURE$ citizens, he lives in a wagon. Whenever our authorities try to book him for violating the ban, he calmly states that his dwelling has not been standing in the same place for 24 hours, and is therefore not a permanent building according to the letter of the law. Every morning at 0700 a.m., like clockwork, he moves the wagon a meter or two. We're becoming laughing stock!;;x
